{
  "candidate": {
    "display_name": "MitchellQuinn",
    "public_repos": 7,
    "type": "github_profile",
    "url": "https://github.com/MitchellQuinn",
    "username": "MitchellQuinn"
  },
  "generated_at": "2026-06-26T18:24:56Z",
  "repositories": [
    {
      "archived": false,
      "clone_url": "https://github.com/MitchellQuinn/workovercv.git",
      "default_branch": "main",
      "description": "WorkOverCV generates evidence-bounded work behaviour profiles from public GitHub repositories, producing structured claims, signals, gaps, mitigations, and review reports.",
      "documentation_presence": "unknown",
      "fork": false,
      "forks": 0,
      "last_updated": "2026-06-26T16:58:35Z",
      "license": null,
      "name": "workovercv",
      "primary_language": "Python",
      "readme_presence": "unknown",
      "release_status": "unknown",
      "repo_id": "mitchellquinn-workovercv",
      "selected_for_review": true,
      "selection_reason": "selected for the starter review scope; substantive default review candidate; non-fork; has description; has primary language metadata; has repository size metadata; has public update metadata",
      "selection_score": 80,
      "stars": 0,
      "test_presence": "unknown",
      "url": "https://github.com/MitchellQuinn/workovercv",
      "visibility": "public",
      "watchers": 0
    },
    {
      "archived": false,
      "clone_url": "https://github.com/MitchellQuinn/agent-working-ledger.git",
      "default_branch": "main",
      "description": "A durable worklog for long-running agent tasks. Agent Working Ledger records objectives, plans, decisions, evidence, blockers, and recovery notes so work can resume cleanly after interruptions, context loss, or handoff.",
      "documentation_presence": "unknown",
      "fork": false,
      "forks": 0,
      "last_updated": "2026-06-26T16:22:19Z",
      "license": "MIT",
      "name": "agent-working-ledger",
      "primary_language": "Python",
      "readme_presence": "unknown",
      "release_status": "unknown",
      "repo_id": "mitchellquinn-agent-working-ledger",
      "selected_for_review": true,
      "selection_reason": "selected for the starter review scope; substantive default review candidate; non-fork; has description; has primary language metadata; has repository size metadata; has public update metadata",
      "selection_score": 80,
      "stars": 0,
      "test_presence": "unknown",
      "url": "https://github.com/MitchellQuinn/agent-working-ledger",
      "visibility": "public",
      "watchers": 0
    },
    {
      "archived": false,
      "clone_url": "https://github.com/MitchellQuinn/skilldoctor.git",
      "default_branch": "main",
      "description": "Deterministic static-analysis toolkit for auditing agent skill packages against explicit contracts, schemas, diagnostics, and reproducible run manifests. Built for local, offline validation with structured reports and no hosted model dependency.",
      "documentation_presence": "unknown",
      "fork": false,
      "forks": 0,
      "last_updated": "2026-06-24T13:29:36Z",
      "license": "Apache-2.0",
      "name": "skilldoctor",
      "primary_language": "Python",
      "readme_presence": "unknown",
      "release_status": "unknown",
      "repo_id": "mitchellquinn-skilldoctor",
      "selected_for_review": true,
      "selection_reason": "selected for the starter review scope; substantive default review candidate; non-fork; has description; has primary language metadata; has repository size metadata; has public update metadata",
      "selection_score": 80,
      "stars": 0,
      "test_presence": "unknown",
      "url": "https://github.com/MitchellQuinn/skilldoctor",
      "visibility": "public",
      "watchers": 0
    },
    {
      "archived": false,
      "clone_url": "https://github.com/MitchellQuinn/claimlint.git",
      "default_branch": "main",
      "description": "Model-agnostic agentic workflow for auditing technical repository claims against evidence.",
      "documentation_presence": "unknown",
      "fork": false,
      "forks": 0,
      "last_updated": "2026-06-12T14:38:12Z",
      "license": "Apache-2.0",
      "name": "claimlint",
      "primary_language": "Python",
      "readme_presence": "unknown",
      "release_status": "unknown",
      "repo_id": "mitchellquinn-claimlint",
      "selected_for_review": true,
      "selection_reason": "selected for the starter review scope; substantive default review candidate; non-fork; has description; has primary language metadata; has repository size metadata; has public update metadata",
      "selection_score": 80,
      "stars": 0,
      "test_presence": "unknown",
      "url": "https://github.com/MitchellQuinn/claimlint",
      "visibility": "public",
      "watchers": 0
    },
    {
      "archived": false,
      "clone_url": "https://github.com/MitchellQuinn/bounded-monocular-perception.git",
      "default_branch": "main",
      "description": "Bounded monocular perception research-engineering stack for a controlled synthetic vision task: fixed-camera ROI localisation, distance and yaw estimation, and raw-image inference pipelines for a known vehicle model.",
      "documentation_presence": "unknown",
      "fork": false,
      "forks": 0,
      "last_updated": "2026-06-02T15:12:24Z",
      "license": "NOASSERTION",
      "name": "bounded-monocular-perception",
      "primary_language": "Python",
      "readme_presence": "unknown",
      "release_status": "unknown",
      "repo_id": "mitchellquinn-bounded-monocular-perception",
      "selected_for_review": true,
      "selection_reason": "selected for the starter review scope; substantive default review candidate; non-fork; has description; has primary language metadata; has repository size metadata; has public update metadata",
      "selection_score": 80,
      "stars": 0,
      "test_presence": "unknown",
      "url": "https://github.com/MitchellQuinn/bounded-monocular-perception",
      "visibility": "public",
      "watchers": 0
    },
    {
      "archived": false,
      "clone_url": "https://github.com/MitchellQuinn/industrial-sound-anomaly-detection.git",
      "default_branch": "main",
      "description": "End-to-end industrial sound anomaly detection on MIMII pump audio, featuring a custom preprocessing pipeline that turns raw audio into heightmap-style spectral representations for 2D CNN classification, with tracked experiments, model cards, metrics, and technical documentation.",
      "documentation_presence": "unknown",
      "fork": false,
      "forks": 0,
      "last_updated": "2026-05-09T12:11:12Z",
      "license": "NOASSERTION",
      "name": "industrial-sound-anomaly-detection",
      "primary_language": "Jupyter Notebook",
      "readme_presence": "unknown",
      "release_status": "unknown",
      "repo_id": "mitchellquinn-industrial-sound-anomaly-detection",
      "selected_for_review": false,
      "selection_reason": "not selected in the initial substantive five-repository review scope",
      "selection_score": 80,
      "stars": 0,
      "test_presence": "unknown",
      "url": "https://github.com/MitchellQuinn/industrial-sound-anomaly-detection",
      "visibility": "public",
      "watchers": 0
    },
    {
      "archived": false,
      "clone_url": "https://github.com/MitchellQuinn/mitchellquinn.git",
      "default_branch": "main",
      "description": null,
      "documentation_presence": "unknown",
      "fork": false,
      "forks": 0,
      "last_updated": "2026-06-21T09:15:54Z",
      "license": null,
      "name": "mitchellquinn",
      "primary_language": null,
      "readme_presence": "unknown",
      "release_status": "unknown",
      "repo_id": "mitchellquinn-mitchellquinn",
      "selected_for_review": false,
      "selection_reason": "not selected by default because it is a profile README repository",
      "selection_score": -15,
      "stars": 0,
      "test_presence": "unknown",
      "url": "https://github.com/MitchellQuinn/mitchellquinn",
      "visibility": "public",
      "watchers": 0
    }
  ],
  "source": {
    "authenticated": false,
    "type": "github_api"
  }
}
